question,bloom_taxonomy_level
What is meant by Frequency-Division Multiplexing? Give the applications.,Remembering
Describe Time-Division Multiple Accessing.,Remembering
What are the challenges in AI deployment at scale?,Analyzing
Draw the state transition diagram for a convolutional encoder with given equations.,Applying
Explain clocked CMOS registers in detail.,Applying
Discuss Electromagnetic Polarization.,Understanding
Explain delay estimation and MOSFET sizing.,Applying
What are the Optical Properties of Radio Waves?,Remembering
Discuss the breakdown mechanisms in semiconductor diodes.,Understanding
Explain how the Q-point is obtained graphically.,Understanding
Tabulate the comparisons between n-well and p-well CMOS fabrication processes.,Analyzing
Explain TCP vs. UDP with examples.,Understanding
Explain in detail about the TCP/IP protocol suite.,Understanding
Explain in detail about the threshold effect in an Angle Modulation System.,Understanding
Discuss the role of Automatic Gain Control (AGC) in AM receivers.,Remembering
Draw and explain the GSM system Architecture.,Applying
What are the benefits of h-parameters?,Understanding
Explain different architectures of artificial neural networks with diagrams.,Understanding
Write a short note on layered network architecture.,Remembering
Explain the concept of adversarial attacks on AI models.,Understanding
Describe the difference between wave attenuation and wave absorption.,Understanding
Explain the classification of embedded systems with examples.,Understanding
What is the role of quality attributes in the embedded system development context? Explain the different Quality attributes to be considered in an embedded system design.,Analyzing
Define relational algebra and its operations.,Remembering
What is the role of MAC addresses in networking?,Remembering
"Compare fixed, collector-to-base, and self-bias circuits.",Analyzing
List three different techniques in Serial Transmission and explain the differences.,Analyzing
Draw the circuit diagram of an SR Master-Slave register and explain its operation.,Understanding
How does reinforcement learning work in gaming applications?,Applying
Explain swarm intelligence techniques such as ant colony optimization.,Understanding
Define the Fermi level and explain its significance in energy band diagrams.,Understanding
What is Digital Line Encoding? Explain any four factors that should be considered when selecting a Line Encoding format.,Understanding
Create a neural network model that can classify handwritten digits with 99.9% accuracy and justify your design choices.,Creating
Write a detailed note on Satellite Multiple-Accessing arrangements.,Understanding
Explain the importance of setup and hold time in CMOS circuits.,Understanding
"What is SQR and give its relationship to resolution, dynamic range, and maximum number of bits in a PCM code?",Understanding
Explain about Skip Distance and Free-space Path Loss.,Understanding
Explain Call Progress Tones and Signals.,Understanding
Fake news detection relies heavily on textual analysis and source verification. Can you propose a new method that identifies misinformation without depending on these techniques?,Creating
Discuss the properties of Electromagnetic Radiation.,Understanding
"Derive expressions for input impedance, voltage gain, and output impedance of a common-source amplifier.",Applying
Formulate a new data compression technique that provides better lossless compression for video files.,Creating
Use Schwartz inequality to find Hopt(f) for a matched filter.,Applying
Explain the working of a depletion-type MOSFET.,Understanding
What is a DBMS? List its advantages over file systems.,Remembering
Draw the schematic circuit of an SR flip flop with negative edge triggering using NAND gates. Give its truth table and explain its operation.,Applying
Write a brief note on the predominant losses in optical fiber cables.,Understanding
Discuss the use of AI in sentiment analysis.,Understanding
Define the following terms: i) Drain resistance ii) Transconductance iii) Amplification factor,Remembering
Explain SR Master-Slave registers with a diagram.,Applying
"Compare centralized, decentralized, and distributed databases.",Understanding
Calculate the ON resistance of an inverter from VDD to GND given sheet resistances.,Applying
"Compute entropy for a source with symbols A, B, C (probabilities 0.5, 0.3, 0.2) and develop Huffman code.",Applying
Design a robotic arm with multiple degrees of freedom for a manufacturing process.,Creating
"Generate codewords for cyclic BCH (15,5) code using g(x)=x10+x8+x5+x4+x2+x+1.",Applying
What are the functionalities of an operating system?,Remembering
Explain in detail about Mobile Telephone Services.,Understanding
How is AI used in robotics and automation?,Understanding
Explain the operation of a single-stage amplifier with a diode-connected load.,Understanding
Analyze a CMOS inverter with its transfer characteristics.,Analyzing
Classify and explain Data Communication Character Codes.,Understanding
Obtain CB parameters in terms of CE parameters.,Applying
Explain in detail about Electromagnetic Polarization and Optical properties of radio waves.,Understanding
Write a short note on Multi-Frequency and Dial Pulses.,Remembering
What is aperture effect? Explain.,Understanding
Define Signal Analysis. Give a brief description of periodic signals.,Remembering
Explain the importance of chatbots in customer service.,Understanding
Write short notes on the ultra-deep-submicron era.,Remembering
Explain the operation of a photo transistor.,Understanding
Demodulate a PSK signal using a coherent receiver.,Applying
Explain FinFET technology and its advantages over MOSFETs.,Understanding
Explain briefly about the losses in Optical Fiber cables.,Understanding
Explain the problem of driving large capacitive loads. How can such loads be driven?,Understanding
Discuss the applications of AI.,Understanding
Explain different types of operating systems with examples.,Understanding
Design a gear system that can efficiently transfer motion between two non-parallel shafts. Explain your design choices.,Creating
Explain the significance of Pre-emphasis and De-emphasis in FM transmission.,Understanding
Explain the body bias effect.,Understanding
List out the difference between analog and digital systems.,Remembering
Explain Call Progress Tones and Signals.,Understanding
Explain OSI and TCP/IP models in computer networks.,Understanding
Explain the characteristics of neural networks.,Understanding
Explain the concept of punch-through/reach-through in a BJT.,Understanding
What is the role of stored procedures in DBMS?,Understanding
Discuss about laser diode.,Understanding
List out major application areas of embedded systems with examples.,Remembering
