question,bloom_taxonomy_level
Explain switch logic implementation using pass transistors.,Understanding
Draw and explain a coherent ASK receiverâ€™s block diagram with equations.,Understanding
"Explain 2 Âµm Double Metal, Double Poly CMOS / Bi-CMOS rules.",Remembering
Describe the error backpropagation algorithm.,Understanding
Compare the advantages of FinFETs and TFETs in ultra-low-power applications.,Understanding
Illustrate how humans are better than computers.,Analyzing
Explain in detail the two-station data communication circuit with suitable diagrams.,Understanding
Tabulate differences between common-source and common-drain amplifiers.,Understanding
Explain how an LED differs from an ordinary PN junction diode and list its applications.,Understanding
Explain the role of AI in cybersecurity.,Understanding
What is aperture effect? Explain.,Understanding
Briefly discuss Master-Slave based edge-triggered registers with a neat diagram.,Understanding
Draw encoder/decoder diagrams for a cyclic code with 1+D+D3.,Applying
What is A* search? Explain with an example.,Understanding
Explain Hadoop and its components.,Understanding
Classify and explain Data Communication Character Codes.,Understanding
Define the terms: i) Cell Splitting ii) Sectoring iii) Segmentation iv) Dualization.,Remembering
Explain the FPGA design process in the Xilinx environment.,Understanding
"Personal AI assistants (e.g., Siri, Alexa) struggle with Understandinging user emotions. Develop a novel mechanism for AI that allows it to interpret emotional context more accurately.",Creating
Draw a standard Cascode current sink circuit and explain its operation.,Understanding
Write a short note on short-channel effects.,Remembering
Explain entity-relationship (E-R) modeling with an example.,Understanding
Draw the FPGA design flow and explain.,Understanding
Write about the shift register design and its implementation onto an FPGA.,Applying
Explain how a Zener diode acts as a voltage regulator.,Understanding
Define the terms: i) Bit Rate ii) Baud iii) Noise Voltage Ratio.,Remembering
Explain different digital signaling techniques.,Understanding
Draw and explain a coherent ASK receiver’s block diagram with equations.,Understanding
What is IP addressing? Explain IPv4 vs. IPv6 differences.,Understanding
Explain about the Synchronous Optical Network (SONET).,Understanding
Explain how optical fiber is constructed with a diagram.,Understanding
Explain the terms: i) Satellite Elevation categories ii) Satellite orbits and orbital patterns.,Understanding
Explain 2Î¼m CMOS design rules and discuss with layout examples.,Remembering
What is fuzzy reasoning? Explain types of fuzzy reasoning systems.,Understanding
Explain Voice-Band Modern with block diagram.,Understanding
Explain why delta modulation is a special case of DPCM.,Understanding
Create a novel method to reduce industrial CO? emissions through chemical absorption.,Creating
What are the advantages and disadvantages of distributed processing?,Understanding
Explain the importance of biasing and define the three stability factors.,Understanding
Describe the United States Digital Cellular System.,Understanding
What is the difference between WDM and D-WDM?,Understanding
Compare full-custom and semi-custom design methodologies.,Understanding
Why is a load flow study required?,Understanding
"Draw and explain Single-Channel, Simplex PCM transmission system.",Understanding
Describe the applications of AI in medical diagnostics.,Understanding
Describe support vector machines (SVM) for classification.,Understanding
What are different types of database models?,Remembering
Define mutual information and list its properties.,Remembering
Explain the fuzzification module.,Understanding
What are N-AMPS?,Remembering
Current AI training models require enormous datasets and computing power. How would you create an AI system that learns efficiently with minimal data?,Creating
What is Redundancy? Write about Character and Message Redundancy.,Understanding
Explain pipelining in digital circuits and its advantages.,Understanding
Explain the concept of Quality of Service (QoS) in networking.,Understanding
Discuss in brief the application of satellite communications.,Understanding
Explain the concept of explainable AI (XAI).,Understanding
List and explain the Optical Properties of Radio Waves.,Understanding
Determine the following: i) The channel capacity for a cellular telephone area comprised of seven microcells with 10 channels per cell. ii) Channel capacity if each microcell is split into four minicells. iii) Channel capacity if each minicell is further split into four microcells.,Applying
What is the significance of Modem Equalizer in Modem Synchronization?,Understanding
What are the salient features of broadcast radio receivers? Explain in detail.,Understanding
Discuss genetic algorithms and their applications.,Understanding
What is Time-Division Multiplexing? Explain with block diagram.,Understanding
Write short notes on high-k metal technology.,Understanding
Describe the primary characteristics of electromagnetic waves.,Understanding
Write short notes on current sinks and sources.,Understanding
Discuss about Wavelength Division Multiplexing (WDM) in detail.,Understanding
Discuss the choice of fan-in and fan-out selection in gate-level design.,Understanding
Explain Amplitude Modulation with a neat sketch.,Understanding
Elaborate the principle of operation of an n-channel enhancement MOSFET and discuss the conditions for different regions of operation.,Understanding
Write short notes on: i) Asynchronous Voice-Band Modems ii) Synchronous Voice-Band Modems.,Understanding
Explain transistor modeling.,Understanding
Define uncertainty. How does it arise in real-time?,Understanding
Derive an expression for the continuity equation and explain its importance.,Applying
Define A-law companding and Î¼-law companding.,Remembering
Propose a mathematical model to predict climate change effects on specific ecosystems over the next 50 years,Creating
Explain error detection techniques in data communication.,Understanding
Write and explain sources of power dissipation in VLSI design.,Understanding
Draw and explain the GSM system Architecture.,Understanding
Explain in detail about the single-mode and multi-mode step-index optical fiber.,Understanding
Implement an Ex-OR logic gate using CMOS logic.,Applying
Explain the working of an enhancement-type MOSFET.,Understanding
Derive entropy for a binary asymmetric channel output.,Applying
Explain the working of a depletion-type MOSFET.,Understanding
Explain the PMOS enhancement mode fabrication process for different conditions of Vds.,Understanding
Explain the merits and limitations of Parallel port over Serial RS-232 interface.,Understanding
Mention the standard organizations for data communications.,Remembering
Discuss the principles of TFET technology.,Understanding
What is Data Communication? Explain briefly data communication circuits.,Understanding
Explain the single-layer continuous perceptron network for linearly separable classification.,Understanding
What is Electrical noise? Write in brief the most prevalent types of Electrical noise.,Understanding
"Compare supervised, unsupervised, and reinforcement learning.",Understanding
Draw and explain the routing architecture of field-programmable gate arrays (FPGAs).,Understanding
Derive the expression for the Fermi level in an intrinsic semiconductor. Express electron and hole concentrations in terms of the Fermi level.,Applying
The current layout of a standard 2:1 multiplexer has excessive delay. Propose an alternative arrangement that improves performance without increasing chip area.,Creating
Develop a plan for an earthquake-resistant high-rise building using innovative materials.,Creating
Why use a common-drain amplifier? Calculate its voltage and current gain.,Applying
Explain Mux-based Latches with an example.,Understanding
Write a short note on Current sources and sinks.,Understanding
Describe the sequence of operation for communicating with an I2C slave device.,Understanding
List out the advantages of Optical Fiber cables.,Remembering
Explain process synchronization and critical section problems.,Understanding
Draw the circuit for an NMOS inverter and explain its operation and characteristics.,Understanding
Determine the pull-up to pull-down ratio for an NMOS inverter driven by one or more pass transistor inverters.,Applying
Explain how a digital camera is implemented using an embedded operating system.,Understanding
Design a 2-input Ex-NOR using CMOS Transmission gate.,Creating
Develop an algorithm to optimize sorting for large datasets with a time complexity better than O(n log n).,Creating
Design a water distribution system for a small town using renewable energy sources.,Creating
Compare A* search with Greedy Best-First Search.,Understanding
Explain schemes for digital data transmission.,Remembering
What are concurrency control techniques in DBMS?,Remembering
Write about Linear versus Non-linear PCM codes.,Remembering
"Derive the expressions for the current gain, voltage gain, input impedance, and output impedance of a CB amplifier using the h-parameter model.",Applying
What is a perceptron? Write the limitations of the perceptron model.,Remembering
Create a smart home automation system that integrates IoT for real-time energy monitoring.,Creating
Write a short note on SONET.,Remembering
Explain the training mechanism adopted in the Hopfield network.,Remembering
Explain the various transistor current components and their significance.,Remembering
Design a complete curriculum for teaching data science to high school students.,Creating
Explain the terms: i) Satellite Elevation categories ii) Satellite orbits and orbital patterns.,Remembering
Explain in detail about Microwave Communication Systems.,Remembering
"Explain about various network topologies. Also, give a brief description of network classification.",Remembering
Explain the use of AI in personalized healthcare.,Remembering
Explain in detail about Error-Correction mechanisms with suitable examples.,Remembering
Discuss briefly about Data Communications Circuits.,Remembering
Write a short note on the four predominant methods of Pulse Modulation.,Remembering
Define FDMA and write about AMPS identification codes.,Remembering
Discuss AI applications in recommendation systems.,Remembering
Define Subscriber Loop. Explain briefly about the working of a standard Telephone Set.,Remembering
Write the steps involved in prototyping the HDL code onto an FPGA device.,Remembering
Define Hamming Distance? Describe any four Error Detection Schemes.,Remembering
Explain about AMPS identification codes.,Remembering
"With a neat block diagram, explain the general system of optical fiber communication.",Remembering
Propose a new sustainable bridge design that minimizes environmental impact while ensuring durability.,Creating
Give the differences between Data Communication and Networks.,Remembering
Compare Linux and Windows operating systems.,Remembering
"Define Î±, Î², and Î³ of a transistor. Show how they are related to each other.",Remembering
Draw the circuit for an NMOS inverter and explain its operation and characteristics.,Remembering
Differentiate between forward chaining and backward chaining.,Remembering
Explain about Ground Wave and Space Wave Propagation.,Understanding
"Explain about Digital and Channel Service Units. Also, distinguish between them.",Understanding
Explain about the constraints in the choice of layers in VLSI design.,Understanding
Explain the operation of a PN junction diode when it is connected in reverse bias and forward bias.,Understanding
What is congestion control in networking? Explain different techniques.,Understanding
Explain the operation of multiplexer-based latches in detail.,Understanding
Define Electromagnetic Waves. Describe their characteristics.,Understanding
Draw the circuit diagram of an SR Master-Slave register and explain its operation.,Understanding
Derive the expression for propagation delay in the case of cascaded pass transistors.,Applying
Draw the h-parameter equivalent circuit for a common base amplifier and derive expressions for Al and Av.,Applying
Explain the relationship between received signal strength and data rate using a constellation diagram.,Understanding
Develop a self-sustaining wastewater treatment plant using microbial fuel cells.,Creating
Discuss different FPGA families and their differences.,Understanding
Describe the classification of Voice-Band Modems.,Understanding
What is a Subscriber Loop?,Remembering
Explain the body bias effect of a MOSFET in detail.,Understanding
What is a trigger in SQL? Explain with an example.,Understanding
Explain Master-Slave registers and cross-coupled NAND/NOR gates.,Understanding
Explain the importance of biasing and define the three stability factors.,Understanding
What is Interrupt? Explain its properties and what is its role in embedded application development?,Understanding
Explain the term setup time and hold time in VLSI circuits.,Understanding
Derive the weight change equation in the input and hidden layers of a backpropagation network.,Applying
Discuss real-time stream processing in Big Data.,Understanding
Derive an expression for transconductance of an n-channel enhancement MOSFET operating in the active region.,Applying
Explain the step-by-step approach of FPGA design in the Xilinx environment.,Understanding
List FPGA families and explain their differences.,Understanding
Explain the relationship between received signal strength and data rate using a constellation diagram.,Understanding
Describe pass transistors briefly with an example.,Understanding
What are the limitations in selecting the operating region in a transistor circuit?,Understanding
Compare connection-oriented and connectionless services.,Understanding
What is meant by intrinsic and extrinsic semiconductors? Explain.,Understanding
Write about the functions of the Telephone Set in detail.,Understanding
Explain how a Zener diode acts as a voltage regulator.,Understanding
"Define Î±, Î², and Î³ of a transistor. Show how they are related to each other.",Remembering
Explain the concept of transaction management in DBMS.,Understanding
What is skip distance?,Remembering
Explain the construction and tunneling phenomenon of a Tunnel diode.,Understanding
Discuss in detail about Peer-to-Peer and Dedicated Client/Server networks.,Understanding
Explain different ways of communication between the serial communication ports.,Understanding
Describe the difference between cable modems and standard voice band modems.,Understanding
Explain diode compensation against variations in base-emitter voltage (VBE).,Understanding
What are FPGAs? Explain about the principle and operation of FPGAs. What are its applications?,Understanding
Explain in detail about the First Generation Analog Cellular Telephone system.,Understanding
Distinguish between Serial and Parallel Data Transmission.,Understanding
Explain the defuzzification module.,Understanding
Draw and explain the optical fiber communication system.,Understanding
What are different disk scheduling algorithms? Explain with examples.,Remembering
Explain why it is better to fix the quiescent operating point in the middle of the active region.,Evaluating
What are the different types of wireless networks?,Remembering
What is meant by Modem Synchronization?,Remembering 
Write down the equations for Ids of an n-channel enhancement MOSFET operating in non-saturated and saturated regions.,Remembering
Write a brief note on GSM Services.,Remembering
Write short notes on 56K Modems.,Remembering
Explain the construction and operation of an SCR.,Understanding
What are DSU and CSU?,Remembering
Design a NOR gate using pass transistor logic.,Applying
Explain backward chaining and its applications.,Understanding 
Explain body bias effect and source degeneration of a common-source amplifier.,Understanding
Explain the decoding logic for a DPSK demodulator.,Understanding 
What are paging and segmentation in memory management?,Remembering
Explain the construction and operation of an SCR.,Understanding
Define and explain Free-Space path loss and Skip Distance.,Remembering 
"Choose values of VGS = 1,2,3,4 and SV, assume that the channel modulation parameter is zero. Sketch to scale the output characteristics of an enhancement n-channel device if VT = 0.7V and ID = 500ÂµA when VGS = 5V in saturation.",Applying
Draw the block diagram of Simplex Microwave Radio Link and explain it.,Remembering 
Write the advantages of optical fiber communication.,Remembering
Explain Î»-based design rules in VLSI circuits.,Understanding
Mention the standard organizations for data communications.,Remembering
Classify MOS scaling types and derive their effects on MOSFET parameters.,Analyzing
What are control strategies in AI problem-solving?,Remembering 
What are the different types of forecasting methods?,Remembering
Explain the working of Ethernet and its frame structure.,Understanding
Explain the difference between Bayesian and certainty factor models.,Understanding
What is a subnet mask? How is it used in networking?,Remembering 
Explain TFET technology.,Understanding
What is the difference between â€˜Hardâ€™ and â€˜Softâ€™ real-time systems? Give an example for â€˜Hardâ€™ and â€˜Softâ€™ Real-Time kernels.,Analyzing
Explain the BiCMOS process over CMOS technology.,Understanding 
Write short notes on Cordless Telephones and Electronic Telephones.,Remembering
List out the advantages and disadvantages of optical fiber transmission.,Remembering
Discuss the role of AI in fraud detection.,Understanding 
Discuss the Non-Linear PCM Codes.,Understanding
"Draw circuits using CMOS, pseudo NMOS, and DCVS ",Applying 
Explain sheet resistance ( R s ) applied to MOS transistors.,Understanding
Explain transistorized bias compensation against variations in base-emitter voltage (VBE).,Understanding 
Write about the classification of Voice-Band Modem.,Understanding
Define Information Capacity and explain about M-ary Encoding.,Understanding
Discuss briefly about Digital Modulation Systems.,Understanding
Explain Digital Modulation with the help of a simplified block diagram.,Remembering 
What are the different types of network protocols?,Remembering
Draw and explain the operation of a common-source amplifier.,Understanding 
Discuss the generalized analysis of a transistor amplifier model using h-parameters.,Analyzing
Draw the VLSI design flow diagram and explain.,Understanding 
How does machine learning enhance data analytics?,Understanding 
Define Open Systems Interconnection (OSI).,Remembering
Write about FPGA programming technologies in detail.,Understanding
Explain the generation of PAM with mathematical analysis.,Understanding
Write a brief note on the predominant losses in optical fiber cables.,Understanding
Explain the concept of Paging Systems.,Understanding
Compare different amplitude modulation techniques.,Understanding
Describe inter-process communication (IPC) mechanisms in OS.,Understanding
How does AI contribute to financial market predictions?,Understanding
Write a detailed note on Retransmission and Forward Error Correction.,Understanding
Discuss about Geosynchronous satellites.,Understanding
Explain the body bias effect of a MOSFET in detail.,Understanding
What is a recurrent network? Explain.,Understanding
What is kernel? What are the different functions handled by a general-purpose kernel? Explain in detail.,Understanding
Explain how thermistors are used for bias compensation.,Understanding
"Explain 2 Âµm Double Metal, Double Poly CMOS / Bi-CMOS rules.",Understanding
How does DHCP work in dynamic IP allocation?,Understanding
Explain the term setup time and hold time in VLSI circuits.,Understanding
Discuss the operation of a UJT with necessary diagrams.,Understanding
Explain how a superheterodyne receiver works.,Understanding
What is Time-Division Multiplexing? Explain with block diagram.,Understanding
Draw and explain the routing architecture of field-programmable gate arrays (FPGAs).,Understanding
Describe Bankerâ€™s Algorithm for deadlock avoidance.,Understanding
Discuss the Linear PCM Codes.,Understanding
Explain the various elements of an embedded system development environment.,Understanding
What is a protocol? Give the key elements of a protocol.,Remembering
Create a new encryption algorithm for securing IoT devices from cyber threats.,Creating
What is the principle of Amplitude Modulation? Derive the expression for the AM wave and draw its spectrum.,Understanding
Explain how compressors and expanders are used for non-uniform quantization.,Understanding
What is Big Data Analytics? Why is it important?,Understanding
List and explain the three orbital patterns used by satellites.,Understanding
What are Microwaves? What are the advantages and disadvantages of Microwave Radio Communications?,Understanding
Define the Fermi level and explain its significance in energy band diagrams.,Understanding
What are the disadvantages in Optical Fiber Cables?,Remembering
Describe constraint satisfaction problems with examples.,Understanding
What is a common-drain amplifier? How do you find the voltage gain of a common-drain amplifier?,Understanding
Explain deep submicron processes with schematic diagrams.,Understanding
"Compare the different transistor amplifier configurations CE, CB, and CC.",Understanding
Write a short note on current sources and sinks.,Remembering
Discuss the breakdown mechanisms in semiconductor diodes.,Understanding
Draw and explain the small-signal model for the MOS transistor.,Understanding
Define Voice-Band Modem. Draw and discuss the Voice-Band Modem Block Diagram.,Understanding
"Draw different shapes of membership functions and create one for the age groups: young"" ""middle-aged"" and ""old.""",Creating
Discuss briefly about Analog Modulation Systems.,Understanding
Explain syndrome decoding and its error pattern identification.,Understanding
What is lambda in economic dispatch?,Remembering
What is a stick diagram? Draw the stick diagram and layout for a CMOS inverter.,Understanding
State Snellâ€™s law for refraction.,Remembering
Develop an AI-based chatbot that adapts its response based on the emotional tone of the user.,Creating
Explain the step-by-step approach of FPGA design in the Xilinx environment.,Understanding
Explain the concept of short-channel effects in detail.,Understanding
"Explain static, dynamic, and domino logics with examples.",Understanding
Existing SRAM designs face a challenge in reducing leakage current. Construct a new cell architecture that minimizes this issue while maintaining speed.,Creating
Explain the need for biasing in electronic circuits. What factors affect the stability factor?,Understanding
What is Electrical noise? Write in brief the most prevalent types of Electrical noise.,Remembering
"Draw the schematic diagram, stick diagram, and layout of a 2-input CMOS NAND gate.",Applying
Define expert systems.,Remembering
Develop a new eco-friendly plastic alternative using biodegradable materials.,Creating
"If you had to create a new type of logic gate that operates with only 2 transistors, what would its functionality be, and how would it integrate into complex circuits?",Creating
Create a new braking system for bicycles that improves safety in wet conditions.,Creating
Explain design rules for layouts.,Understanding
Explain different wiring capacitances used in gate-level design with an example.,Understanding
Draw and explain the operation of a common-source amplifier.,Understanding
Write a detailed note on Wavelength Division Multiplexing.,Understanding
Explain the BiCMOS process over CMOS technology.,Understanding
Explain the advantages of â€˜High Level languageâ€™ based â€˜Embedded firmwareâ€™ development.,Understanding
Explain recurrent neural networks (RNNs) and their applications.,Understanding
Design a process to optimize the extraction of lithium for battery production.,Creating
Compare preemptive and non-preemptive scheduling.,Understanding
What are the benefits of h-parameters?,Understanding
What is the early effect? Explain the effect of the early effect on transistor characteristics.,Understanding
Define the following: i) Clarke orbit ii) Free-space path loss.,Remembering
Explain the sigmoid function with a neat sketch.,Understanding
What are heuristics in AI search techniques?,Remembering
How does a distributed database work? Explain advantages and disadvantages.,Understanding
What are the limitations in selecting the operating region in a transistor circuit?,Understanding
What is meant by Network Topology? Draw and explain the structure of all Multipoint Topologies.,Understanding
Design a new type of gearbox that improves efficiency by 30% for an electric vehicle.,Creating
Write about the modes of propagation of light through optical fiber.,Remembering
"With necessary equations, derive charge densities in a semiconductor material.",Applying
Define Multiplexing. Explain briefly about Time-Division Multiplexing (TDM).,Understanding
Discuss the limits of scaling and explain why scaling is necessary for VLSI circuits.,Understanding
Explain small signal analysis of a common-source FET amplifier.,Understanding
Explain pipelining in digital circuits and its advantages.,Understanding
What is COMPANDING? Write about ANALOG COMPANDING.,Remembering
Draw the small signal model of an FET and explain the significance of each element.,Understanding
