question,bloom_taxonomy_level
Compare full-custom and semi-custom design methodologies.,Understandinging
Explain High-k metal technology.,Understandinging
Explain in detail about the First Generation Analog Cellular Telephone system.,Understanding
Explain natural language processing (NLP) and its challenges.,Understanding
Explain the operation of a single-stage amplifier with resistive load.,Understanding
Define mutual information and list its properties.,Understanding
"Briefly describe the significance of the Shannon limit for information capacity. Given a standard telephone circuit with a signal-to-noise power ratio of 30dB and a bandwidth of 2.7 kHz, determine the Shannon limit for information capacity.",Applying
Define ripple factor and calculate the ripple factor of a half-wave rectifier.,Remembering
Discuss the generalized analysis of a transistor amplifier model using h-parameters.,Understanding
Explain about Basic Telephone Call Procedures.,Understanding
Discuss cloud computing and AI integration.,Understanding
Discuss the importance of explainability in AI models.,Understanding
What is the role of system calls in OS? Explain types of system calls.,Understanding
Derive the voltage gain equation for a common source amplifier at high frequencies.,Applying
Explain the importance of pass-transistor logic with examples.,Understanding
Explain k-means clustering with a suitable example.,Understanding
Discuss how Threads and Processes are related. What parameters are common to Process and Threads? Explain in detail.,Understanding
Define Multiplexing. Describe its goals and importance.,Understanding
Determine L=2n for a PCM signal with Î¼=100 and SNR = 40 dB. Calculate output SQNR.,Applying
Explain how an LED differs from an ordinary PN junction diode and list its applications.,Understanding
Write short notes on metastability in CMOS logic.,Understanding
"For a 12-bit data string of 101100010010, determine the number of Hamming bits required, assume an arbitrary single-bit transmission error, and prove that the Hamming code will successfully detect the error.",Applying
Explain the concept of punch-through/reach-through in a BJT.,Understanding
What is Redundancy? Write about Character and Message Redundancy.,Understanding
"Compute entropy for a source with symbols A, B, C (probabilities 0.5, 0.3, 0.2) and develop Huffman code.",Applying
Explain Paging Systems.,Understanding
"For a single-mode optical cable with an optical cable 0.25 dB/km loss, determine the optical power 100 km from a 0.1 mW light source.",Applying
Explain alternate gate circuits using a NAND gate as an example.,Understanding
Write in brief about Serial and Parallel Data Transmission.,Understanding
Explain schemes for digital data transmission.,Understanding
Explain how PPM can be generated from PWM signals.,Understanding
Write short notes on high-k metal technology.,Understanding
What is a network topology? Classify different network topologies.,Understanding
Draw a CMOS inverter circuit and explain transfer characteristics using equations.,Understanding
Design a new circuit that automatically switches between solar power and grid power based on availability.,Creating
What is a process? Explain process states with a state transition diagram.,Understanding
Determine the pull-up to pull-down ratio for an NMOS inverter driven by another NMOS inverter.,Applying
Explain Master-Slave Edge-Triggered Registers.,Understanding
Classify and explain Bar Codes.,Understanding
What is pattern association?,Understanding
What are the advantages of optical fiber cables?,Understanding
Write down the equations for Ids of an n-channel enhancement MOSFET operating in non-saturated and saturated regions.,Remembering
Describe different types of joins in SQL with examples.,Understanding
Describe the losses in Optical Fiber Cables.,Understanding
Define Electromagnetic Radiation. Write the mathematical representation of power density.,Applying
Explain the fuzzy inference engine.,Understanding
Write in brief about Random and Broadcast control channels.,Understanding
What is meant by Diffraction?,Remembering
"Depicting the organization of layers, explain the Open System Interconnection model.",Understanding
What is deadlock? Explain necessary conditions for deadlock.,Understanding
Write short notes on the modeling of a transistor in detail.,Understanding
Explain the trade-off between bandwidth and SNR.,Understanding
Give the construction details and characteristics of enhancement mode MOSFET.,Remembering
What are ethical concerns in AI development?,Remembering
Draw the small signal model of an FET and explain the significance of each element.,Understanding
List the Modem operational modes.,Remembering
Explain the operation of a common-gate amplifier with a diagram.,Understanding
Explain the characteristics of Electromagnetic waves.,Understanding
Write a short note on the Giga-scale dilemma.,Understanding
Derive an expression for the continuity equation and explain its importance.,Understanding
What is the use of Cladding in an Optical Fiber? Give the limitations of Optical Fiber.,Remembering
Develop a conceptual model for a heat exchanger that improves efficiency while reducing material costs.,Creating
Design a new type of antenna that optimizes signal strength for 5G networks.,Creating
Write in detail about the optical properties of Radio Waves.,Understanding
Explain Amplitude Modulation with a neat sketch.,Understanding
Explain the piecewise linear function with a neat sketch.,Understanding
Explain the architecture of a recommendation system.,Understanding
Explain hybrid AI systems and their advantages.,Understanding
What are Microwaves? What are the advantages and disadvantages of Microwave Radio Communications?,Remembering
Derive the expression for the Fermi level in an intrinsic semiconductor. Express electron and hole concentrations in terms of the Fermi level.,Understanding
Explain small signal analysis of a common-source FET amplifier.,Analyzing
Explain the minimax algorithm.,Understanding
"For a 20-channel PCM/TDM system with an 8-KHz sample rate, 10 bits per sample, and one framing bit per frame, determine the Line speed.",Applying
What is virtual memory? How does it improve system performance?,Understanding
Design a database system that optimizes data retrieval speed for large-scale applications.,Creating
"Derive the expressions for the current gain, voltage gain, input impedance, and output impedance of a CB amplifier using the h-parameter model.",Understanding
What is the importance of reactive power? Explain reactive power control using a fuzzy logic controller.,Understanding
What is feedforward recall?,Remembering
"Draw and explain Single-Channel, Simplex PCM transmission system.",Understanding
Write about FPGA programming technologies in detail.,Understanding
"With necessary equations, derive charge densities in a semiconductor material.",Understanding
Explain BiCMOS fabrication in the p-well process and its operation.,Understanding
Explain demand paging and page replacement algorithms.,Understanding
What are the characteristics of Electromagnetic waves?,Understanding
Sketch the block diagram of a digital camera and explain digital camera implementation in an embedded operating system.,Understanding
Explain DNS (Domain Name System) and its hierarchy.,Understanding
Explain why delta modulation is a special case of DPCM.,Understanding
Compare transistor amplifiers and explain their differences.,Understanding
How can we check the effectiveness of data communication?,Evaluating
Discuss the importance of data warehousing and data mining.,Understanding
What is meant by Network Topology? Draw and explain the structure of all Multipoint Topologies.,Understanding
Demodulate a PSK signal using a coherent receiver.,Applying
Explain the threshold function with a neat sketch.,Understanding
Explain clocked CMOS registers in detail.,Understanding
Explain the various details held by a Map file generated during the process of cross-compiling an Embedded C project.,Understanding
Explain the different sources of wiring capacitances and their impact on VLSI circuit performance.,Understanding
Write short notes on the modeling of a transistor in detail.,Understanding
Describe methods for driving large capacitive loads.,Understanding
Explain the characteristics of AI problems.,Understanding
"Compare the performance of inductive, L-section, and Ï€-section filters.",Analyzing
Implement the McCulloch-Pitts network for the AND logic function.,Applying
Define Carrier Systems and explain in detail about T-Carrier Systems.,Understanding
Explain pipelining for optimizing sequential circuits.,Understanding
"Discuss pattern recognition, control, and beamforming learning tasks.",Understanding
Explain briefly about Frequency-Division Multiplexing (FDM).,Understanding
Explain the different types of design rules and give some examples.,Understanding
Define Artificial Intelligence.,Remembering
Explain why it is better to fix the quiescent operating point in the middle of the active region.,Understanding
Derive entropy for a binary asymmetric channel output.,Understanding
Explain in detail about the single-mode and multi-mode step-index optical fiber.,Understanding
Determine the Checksum for the following data and CRC-generating polynomials: ( G(x) = x^7 + x^4 + x^2 + x^0 ) ( P(x) = x^5 + x^4 + x^1 + x^0 ),Applying
What is indexing in a database? Explain different types of indexing.,Understanding
Describe in detail about Satellite Communication Systems.,Understanding
What is deep learning? Explain its importance in modern AI.,Understanding
Explain briefly about First Generation Analog Cellular Telephone Systems.,Understanding
Discuss the limits of scaling and explain why scaling is necessary for VLSI circuits.,Understanding
What are convolutional neural networks (CNNs)? Explain their working.,Understanding
Explain how optical fiber is constructed with a diagram.,Understanding
Write short notes on the ultra-deep-submicron era.,Understanding
Design a web-based adaptive learning system that dynamically adjusts content difficulty based on user performance.,Creating
Explain the PMOS enhancement mode fabrication process for different conditions of Vds.,Understanding
What is Multiplexing? Define Time Division Multiplexing.,Understanding
"Compare circuit switching, packet switching, and message switching.",Analyzing
Invent a new braking system for bicycles that enhances safety without using traditional disc or drum brakes.,Creating
Define Electromagnetic Radiation. Write the mathematical representation of power density.,Remembering
Explain why the self-biasing arrangement cannot be used in an enhancement-type MOSFET.,Understanding
What are optical fiber modes? Explain.,Understanding
Explain the working of an enhancement-type MOSFET.,Understanding
Draw the stick diagram for a 3-input NAND gate.,Applying
Explain why the self-biasing arrangement cannot be used in an enhancement-type MOSFET.,Understanding
Write about Linear versus Non-linear PCM codes.,Understanding
Explain reinforcement learning with an example.,Understanding
What are the Optical Properties of Radio Waves?,Understanding
Define Metallic Transmission Lines. Explain the types of metallic transmission lines.,Understanding
List out the disadvantages of optical fiber.,Remembering
Discuss the different â€˜embedded firmware designâ€™ approaches in detail.,Understanding
Explain in detail about the On-Chip Debugging (OCD).,Understanding
Compare BCNF and 3NF with examples.,Analyzing
Discuss about the ISO/OSI reference model with a neat sketch.,Understanding
Explain the significance of Hall Effect and its applications.,Understanding
Compare macro cellular system and digital cellular system.,Analyzing
Explain how a DSB-SC signal is detected using a coherent detector.,Understanding
What are the advantages of optical fiber cables?,Remembering
Discuss security threats and protection mechanisms in OS.,Understanding
Design a 2-input Ex-OR using CMOS Transmission gate.,Applying
Explain the concept of query optimization in SQL.,Understanding
Compare the advantages of FinFETs and TFETs in ultra-low-power applications.,Understanding
"Explain CLB, IOB, and programmable interconnects in an FPGA design.",Understanding
What is NAT (Network Address Translation)? How does it work?,Understanding
Create a fault-tolerant CMOS inverter that can still function under partial transistor failure.,Creating
Write a detailed note on Synchronous Voice-Band Modem.,Understanding
What is meant by the learning process?,Remembering
Draw encoder/decoder diagrams for a cyclic code with 1+D+D3.,Applying
Explain the trade-off between bandwidth and SNR.,Understanding
What is latch-up? How can it be eliminated?,Understanding
What is the difference between propositional logic and predicate logic?,Understanding
Discuss the operation of a UJT with necessary diagrams.,Understanding
Explain the future trends in AI research.,Understanding
Illustrate the watchdog timer for firmware execution supervision.,Applying
List out the advantages of Optical Fiber cables.,Remembering
Create an urban drainage system to prevent flooding in high-rainfall areas.,Creating
Draw the state transition diagram for a convolutional encoder with given equations.,Applying
Develop an innovative method to reduce power losses in a transmission system.,Creating
Explain the importance of heuristics in AI search.,Understanding
Explain the impact of AI on supply chain management.,Understanding
Explain in detail about Frequency Division Multiplexing.,Understanding
Draw and explain a BiCMOS inverter.,Understanding
"Explain SQL commands: DDL, DML, DCL, and TCL.",Understanding
What is meant by Redundancy Checking? Explain four basic types of Redundancy Checks.,Understanding
Design a 2-input Multiplexer using CMOS Transmission gate.,Creating
Describe how AI is used in self-driving cars.,Understanding
Describe the different categories of Satellites.,Understanding
What are the advantages of Microwave Radio Communication?,Remembering
Discuss the principles of TFET technology.,Understanding
What is a semaphore? How does it help in process synchronization?,Understanding
What is normalization? Explain different normal forms.,Understanding
Explain about the Optical Fiber Communications System with a block diagram.,Understanding
Explain the operation of a photo transistor.,Understanding
Design an energy harvesting system that generates power from walking movements in urban areas.,Creating
Discuss federated learning and its applications.,Understanding
Describe economic load dispatch using artificial neural networks.,Understanding
What are ACID properties in DBMS? Why are they important?,Understanding
Draw the circuit diagram of a single-stage amplifier with a resistive load and explain its operation.,Understanding
Explain about Personal Communication System. Give its advantages and disadvantages.,Understanding
Discuss briefly about Quadrature Amplitude Modulation.,Understanding
Explain how thermistors are used for bias compensation.,Understanding
Explain in detail about Error-Detection mechanisms with suitable examples.,Understanding
Explain syndrome decoding and its error pattern identification.,Understanding
Describe in detail about Terrestrial Propagation of Electromagnetic Waves.,Understanding
"Generate codewords for cyclic BCH (15,5) code using g(x)=x10+x8+x5+x4+x2+x+1.",Applying
Explain the process of Frequency Division Multiplexing.,Understanding
Explain the problem of driving large capacitive loads. How can such loads be driven?,Understanding
Determine L=2n for a PCM signal with Î¼=100 and SNR = 40 dB. Calculate output SQNR.,Applying
Explain inductive reasoning in fuzzy membership assignment.,Understanding
"Depicting the organization of layers, explain the Open System Interconnection model.",Understanding
What are the classes of transmission media?,Remembering
What is meant by Diffraction?,Remembering
Discuss different FPGA families and their differences.,Understanding
Explain how compressors and expanders are used for non-uniform quantization.,Understanding
Explain why a matched filter is called an optimum filter.,Understanding
Explain the different sources of wiring capacitances and their impact on VLSI circuit performance.,Understanding
"Explain static, dynamic, and domino logics with examples.",Understanding
Explain in detail about Layered Network Architecture.,Understanding
Explain the concept of knowledge representation in artificial neural networks.,Understanding
Discuss the role of AI in natural language processing (NLP).,Understanding
How does the depletion region around the source and drain change due to scaling down of device dimensions?,Understanding
Discuss different types of file systems in an operating system.,Understanding
Use Schwartz inequality to find Hopt(f) for a matched filter.,Applying
Explain Time-to-market? What is its significance in product development?,Understanding
What is VPN? How does it ensure secure communication?,Understanding
What is an FPGA? Draw its structure and list advantages.,Understanding
Explain how light propagates through optical fiber.,Understanding
Differentiate between crisp sets and fuzzy sets.,Understanding
Draw and explain the V-I characteristics of a Varactor diode.,Understanding
Describe the working of firewalls and intrusion detection systems.,Understanding
Describe fuzzy Cartesian product with expressions.,Understanding
Describe fuzzy logic with an example.,Understanding
Explain briefly about Spherical Wavefront and the Inverse Square Law.,Understanding
Write the sequence of the learning process.,Remembering
Explain the operation of multiplexer-based latches in detail.,Understanding
Write a short note on layered network architecture.,Understanding
"Discuss in detail about the construction of Optical Fiber. Also, list the advantages of Optical Fiber cables.",Understanding
Draw the h-parameter equivalent circuit for a common base amplifier and derive expressions for Al and Av.,Applying
How does the depletion region around the source and drain change due to scaling down of device dimensions?,Understanding
Why are pre-emphasis and de-emphasis needed in FM but not in AM? Explain.,Understanding
Explain about wave propagation on metallic transmission lines and metallic transmission line losses.,Understanding
Explain about diagonal clipping in a diode detector. How can it be eliminated?,Understanding
Explain how the Q-point is obtained graphically.,Understanding
Explain BiCMOS fabrication in the p-well process and its operation.,Understanding
Explain Static power dissipation and Dynamic power dissipation.,Understanding
"Derive expressions for input impedance, voltage gain, and output impedance of a common-source amplifier with a source resistor.",Applying
Describe the significance of deep learning in image processing.,Understanding
"Derive expressions for input impedance, voltage gain, and output impedance of a common-drain amplifier.",Applying
Discuss briefly about Signal-to-Noise Ratio.,Understanding
What is the difference between direct and indirect methods of FM generation? Explain the working of a balanced frequency discriminator with the help of a circuit diagram.,Understanding
Explain about Asynchronous Voice-Band Modems with a neat Sketch.,Understanding
Describe different types of CPU scheduling algorithms.,Understanding
Define FDMA and write about AMPS identification codes.,Understanding
Explain the construction and tunneling phenomenon of a Tunnel diode.,Understanding
What is PCM Line speed? Represent it mathematically.,Understanding
Describe different types of network topologies with diagrams.,Understanding
Describe rule-based expert systems.,Understanding
Explain the radial basis function algorithm.,Understanding
What is ROM emulation? Explain In Circuit Emulator (ICE) based debugging in detail.,Understanding
Explain a new way to visualize multi-dimensional datasets in a way that improves human interpretability without reducing information density.,Creating
What is the use of the backpropagation algorithm?,Understanding
What are NoSQL databases? Compare them with relational databases.,Understanding
Explain the significance of barcodes in detail.,Understanding
Derive Idl dVdsv ds relationship of MOS in the Resistive region.,Applying
Write a short note on the four predominant methods of Pulse Modulation.,Understanding
Write a short note on Multi-Frequency and Dial Pulses.,Remembering
Explain the three levels of database architecture.,Understanding
Explain the need for biasing in electronic circuits. What factors affect the stability factor?,Understanding
"Explain Fan-in, Fan-out, and Choice of layers in gate-level design.",Remembering
What is CDMA? Explain in Detail.,Remembering
What is sheet resistance? Derive the Expression for Rs.,Understanding
Build a machine learning model that predicts traffic congestion and suggests alternative routes.,Creating
"Compare the performance of inductive, L-section, and Ï€-section filters.",Understanding
Explain the operation of a common-gate amplifier with a diagram.,Remembering
Discuss about DIGITAL COMPANDING.,Remembering
Explain diode compensation against variations in base-emitter voltage (VBE).,Understanding
Explain in detail the p-well process for CMOS fabrication indicating the masks used.,Understanding
Briefly describe ATCT FDM hierarchy.,Remembering
Draw and explain the V-I characteristics of a Varactor diode.,Understanding
Write short notes on metastability in CMOS logic.,Remembering
Explain FinFET technology.,Remembering
"Explain the following operations on crisp sets with examples: (i) Complement, (ii) Difference.",Understanding
Explain the various factors to be considered for the selection of scheduling criteria.,Understanding
Compare transistor amplifiers and explain their differences.,Understanding
"Define fuzzy sets and verify properties such as complement, associativity, and idempotence.",Understanding
Explain why a matched filter is called an optimum filter.,Understanding
What is Digital Line Encoding? Explain any four factors that should be considered when selecting a Line Encoding format.,Understanding
Write about the shift register design and its implementation onto an FPGA.,Understanding
Explain transistorized bias compensation against variations in base-emitter voltage (VBE).,Understanding
What is knowledge representation?,Remembering
Explain about the architecture of Global System for Mobile Communications (GSM).,Understanding
Explain the concept of short-channel effects in detail.,Understanding
"With a neat block diagram, explain the operation of a Frequency Division Multiplexing technique.",Understanding
What is meant by transistor biasing? Describe various biasing methods.,Understanding
Distinguish between Synchronous and Asynchronous Voice-Band Modems.,Understanding
Compare paging and segmentation memory management techniques.,Understanding
Describe Dynamic CMOS logic and np CMOS Logic.,Understanding
Compute the centroid using the centroid method.,Applying
Explain briefly about Signal Voltage-to-Quantization Noise Voltage Ratio.,Understanding
"Compare fixed, collector-to-base, and self-bias circuits.",Understanding
Explain about the OSI seven-layer International Protocol hierarchy.,Understanding
Write the steps involved in prototyping the HDL code onto an FPGA device.,Remembering
Explain MapReduce with an example.,Understanding
Describe Pseudo NMOS logic and Domino CMOS Logic.,Understanding
Define Cable Modems. Give its main advantages.,Understanding
Write the mathematical expression for a membership function.,Remembering
Describe AI applications in smart cities and IoT.,Understanding
Explain the semantic network approach.,Understanding
Define and explain Metastability.,Understanding
Explain about Data Communication Networks.,Understanding
Explain different digital signaling techniques.,Understanding
Explain decision trees and their role in AI.,Remembering
What are the characteristics of Electromagnetic waves?,Remembering
Draw the circuit diagram of a single-stage amplifier with a resistive load and explain its operation.,Understanding
Write short notes on Ratioed Circuits and Dynamic Circuits.,Remembering
Explain CMOS n-Well Fabrication steps with neat sketches.,Understanding
What is the significance of layered architecture in computer networks?,Understanding
Define predicate logic. Explain inference rules.,Remembering
What are the drawbacks of Delta Modulation (DM)? How can we overcome those drawbacks?,Understanding
Explain routing algorithms: Distance Vector vs. Link State.,Understanding
Explain Voice-Band Modern with block diagram.,Understanding
List out any four advantages of Optical Fiber cables.,Remembering
What are DSU and CSU?,Remembering
What is a current mirror? Explain the general properties of a current mirror with a block diagram.,Understanding
Obtain CB parameters in terms of CE parameters.,Applying
Define Pulse Code Modulation (PCM). Explain briefly about PCM with suitable diagrams.,Understanding
Explain the importance of pass-transistor logic with examples.,Understanding
What are the different types of pre-processor directives available in â€˜Embedded Câ€™? Explain them in detail.,Remembering
Explain FinFET technology and its advantages over MOSFETs.,Understanding
Illustrate the functional blocks of FPGAs with a neat architecture diagram.,Understanding
Explain thrashing in OS. How can it be prevented?,Understanding
Explain the decoding logic for a DPSK demodulator.,Understanding
